{
  "$schema": "../../../core/schema/extension.schema.json",
  "name": "self-improvement",
  "summary": "The /improve self-improvement cycle: mine traces → propose a reviewable AGENTS.md diff (never a live model, never auto-committed). Applies only when explicitly armed (/improve arm [id]), which applies a proposal already written for review rather than mining again, and only to the allowlisted AGENTS.md 'Learned notes' section.",
  "category": "execution",
  "tier": "T4",
  "layer": 6,
  "entry": "index.ts",
  "hooks": [],
  "registers": { "tools": [], "commands": ["improve"] },
  "profiles": ["self-improving"],
  "enabledByDefault": false,
  "platforms": ["windows", "linux", "darwin"],
  "runtime": {
    "nodeBuiltins": ["node:crypto", "node:fs", "node:path"],
    "npm": [],
    "piPeers": [],
    "services": [],
    "models": []
  },
  "pulls": ["trace-ledger"],
  "env": [],
  "provenance": { "origin": "custom" },
  "homeRepo": null,
  "status": "beta"
}
