{
  "$schema": "../../../core/schema/extension.schema.json",
  "name": "autonomy-run",
  "summary": "Operator command /autonomy: create, plan, start and manage autonomous runs (the packages/autonomy engine) from inside pi. A run starts only after you confirm its resolved boundary on screen, or from a contract that already carries an authorisation for exactly that boundary; it is a command, not a tool, so the model cannot start, steer, authorise or promote a run.",
  "category": "workflow",
  "tier": "T3",
  "layer": 4,
  "entry": "index.ts",
  "hooks": [],
  "registers": { "tools": [], "commands": ["autonomy"] },
  "profiles": ["autonomous"],
  "enabledByDefault": true,
  "platforms": ["linux", "darwin"],
  "runtime": {
    "nodeBuiltins": ["child_process", "fs", "os", "path", "url"],
    "npm": [],
    "piPeers": ["@earendil-works/pi-coding-agent"],
    "services": ["a container engine (Podman or Docker) for the runs themselves"],
    "models": []
  },
  "pulls": [],
  "env": ["PI_KIT_NODE", "PI_AUTONOMY_CLI", "PI_AUTONOMY_HOME"],
  "provenance": { "origin": "custom" },
  "homeRepo": null,
  "status": "beta"
}
