{
  "$schema": "../../../core/schema/extension.schema.json",
  "name": "session-helpers",
  "summary": "Session-control helpers: /clear guidance, all-or-nothing /profile switching (snapshots every config file, verifies marker, extension list and firewall, rolls back byte-for-byte on any failure, /profile status prints the effective configuration), /compaction status and toggles backed by the real effective compaction state (published on globalThis, warned once per session), and a lean-ctx binary preflight.",
  "category": "ui",
  "entry": "index.ts",
  "hooks": ["session_start", "model_select", "before_agent_start", "session_shutdown"],
  "registers": { "tools": [], "commands": ["clear", "profile", "compaction"] },
  "profiles": ["quick", "balanced", "long-horizon", "autonomous", "self-improving", "pentest", "lite"],
  "enabledByDefault": true,
  "platforms": ["windows", "linux", "darwin"],
  "runtime": {
    "nodeBuiltins": ["fs", "os", "path", "url"],
    "npm": [],
    "piPeers": [],
    "services": [],
    "models": []
  },
  "pulls": [],
  "env": ["PI_KIT_ROOT", "PI_KIT_AUTO_PROFILE"],
  "provenance": { "origin": "custom" },
  "homeRepo": null,
  "status": "beta"
}
